{
  "$schema": "http://json-schema.org/draft-07/schema#",
  "title": "Artifact",
  "type": "object",
  "required": [
    "id",
    "source",
    "tags"
  ],
  "properties": {
    "body_text": {
      "type": [
        "string",
        "null"
      ]
    },
    "content_type": {
      "type": [
        "string",
        "null"
      ]
    },
    "id": {
      "type": "string"
    },
    "source": {
      "$ref": "#/definitions/SourceRef"
    },
    "tags": {
      "type": "array",
      "items": {
        "type": "string"
      }
    },
    "title": {
      "type": [
        "string",
        "null"
      ]
    }
  },
  "definitions": {
    "SourceRef": {
      "type": "object",
      "required": [
        "kind",
        "retrieved_at",
        "value"
      ],
      "properties": {
        "kind": {
          "type": "string"
        },
        "retrieved_at": {
          "type": "string"
        },
        "value": {
          "type": "string"
        }
      }
    }
  }
}